{
  "schema_version": 2,
  "packet_id": "pkt-v2-tunnel-001",
  "device_id": "pi5-hailo-demo-01",
  "session_id": "sess-2026-07-09-shift-c",
  "block_start": "2026-07-09T03:30:00+08:00",
  "block_minutes": 15,
  "metrics": {
    "drowsiness_score": 0.62,
    "distraction_score": 0.15,
    "eyes_off_road_seconds": 4,
    "sample_coverage_pct": 93,
    "steering_entropy": 0.31,
    "eyelid_velocity_mean": 0.71,
    "eyelid_velocity_ratio_vs_baseline": 0.88,
    "steering_entropy_ratio_vs_baseline": 0.82,
    "ear_mean": 0.22,
    "gaze_shift_velocity_mean": 142.5,
    "fixation_duration_max_seconds": 4.8,
    "head_yaw_velocity_mean": 0.04,
    "inter_movement_latency_mean_ms": 285,
    "saccade_peak_velocity_ratio_vs_baseline": 0.91
  },
  "operational_flags": {
    "silent_observation_mode": false,
    "suspect_pre_fatigue": false,
    "unintended_drift_anomaly": false,
    "haptic_fired_in_block": true,
    "main_sequence_decoupling": false,
    "cognitive_tunneling": true,
    "nodding_micro_sleep": false
  }
}
